2,北部,宜蘭縣,台灣足鞋健康知識館,宜蘭縣五結鄉中興村中里路18號,03-9500551#501,www.drfoot.com.tw
3,北部,宜蘭縣,安永心食館,宜蘭縣蘇澳鎮中山路二段415號,03-9953399,www.anyomuseum.com/
4,北部,宜蘭縣,亞典蛋糕密碼館,宜蘭縣宜蘭市梅洲二路122號,03-9286777,www.rden.com.tw
5,北部,宜蘭縣,宜蘭餅發明館,宜蘭縣蘇澳鎮海山西路369號,03-9905999,www.diy-icake.com.tw
6,北部,宜蘭縣,金車噶瑪蘭威士忌酒廠,宜蘭縣員山鄉員山路二段326號,03-9229000#1104,www.kavalanshisky.com
8,北部,宜蘭縣,菌寶貝博物館,宜蘭縣宜蘭市梅洲一路22號,03-9281168,www.bio-nin.com.tw
9,北部,宜蘭縣,綺麗博物館,宜蘭縣蘇澳鎮利工一路一段6號,03-9905388,tw.cljewels.com/index_down.php
10,北部,宜蘭縣,臺灣菸酒股份有限公司宜蘭酒廠觀光工廠,宜蘭縣宜蘭市舊城西路3號,03-9355526#461,event.ttl-eshop.com.tw/yl/
